timestamp,question,answer,faithfulness,answer_relevancy,context_precision,context_recall,answer_correctness
2025-10-20 09:20:38,Chi deve approvare il Learning Agreement?,"Risposta ibrida (α=0.6): Il Learning Agreement deve essere approvato dal Delegato del Dipartimento e dall'ente ospitante, come specificato nel contesto di [Fonte 1], dove si legge: ""Il Learning Agreement deve essere approvato dal Delegato del Dipartimento e dall'ente ospitante."" Inoltre, [Fonte 2] conferma questa informazione, indicando che ""Il Learning Agreement deve essere approvato dal Delegato del Dipartimento e dall'Università ospitante."" Pertanto, sia il Delegato del Dipartimento che l'ente ospitante (o Università ospitante) devono approvare il Learning Agreement.",1.000,1.000,1.000,1.000,0.967
2025-10-20 09:20:38,Qual è la lingua richiesta per partecipare a un tirocinio Erasmus?,"Risposta ibrida (α=0.6): La lingua richiesta per partecipare a un tirocinio Erasmus è quella richiesta dall'Università ospitante, come indicato nel testo: ""avere un'adeguata conoscenza della lingua richiesta dall'Università ospitante"" e ""la conoscenza della lingua richiesta dall'Università ospitante (opportunamente certificata)"". Non è specificata una lingua unica e obbligatoria per tutti i tirocini Erasmus, ma piuttosto la conoscenza della lingua richiesta dall'Università ospitante in cui si svolgerà il tirocinio.",0.600,0.992,0.250,1.000,0.650
2025-10-20 09:20:38,Chi approva il riconoscimento dei CFU dopo il tirocinio Erasmus?,Risposta ibrida (α=0.6): Non presente nei documenti,nan,0.000,0.000,0.000,0.134
2025-10-20 09:20:38,Quali documenti sono richiesti per un tirocinio autonomo?,Risposta ibrida (α=0.6): Non presente nei documenti.,1.000,0.000,0.000,0.000,0.139
2025-10-20 09:20:38,Quando si aprono le immatricolazioni per l'anno accademico 2025/2026?,"Risposta ibrida (α=0.6): Le immatricolazioni per l'anno accademico 2025/2026 si aprono il 1 agosto 2025, come indicato nella Fonte 1, che fornisce la data specifica di apertura delle immatricolazioni, mentre le altre fonti menzionano l'anno accademico 2025/2026 senza fornire la data di apertura delle immatricolazioni, ad eccezione della Fonte 4 che menziona gli immatricolati e iscritti ad anni successivi nell'a.a. 2025/26, senza però specificare la data di apertura.",0.875,1.000,1.000,1.000,0.366
2025-10-20 09:20:38,Qual è la scadenza per immatricolarsi ai corsi di laurea triennale e magistrale a ciclo unico ad accesso libero?,"Risposta ibrida (α=0.6): La scadenza per immatricolarsi ai corsi di laurea triennale e magistrale a ciclo unico ad accesso libero è prevista per il giorno 20 ottobre 2025, come indicato in uno dei documenti ufficiali disponibili.",1.000,1.000,1.000,1.000,0.679
2025-10-20 09:20:38,Fino a quando è possibile immatricolarsi ai corsi di laurea magistrale biennali?,"Risposta ibrida (α=0.6): Il termine per le immatricolazioni ai corsi di laurea magistrali biennali è fissato nel giorno 2 marzo 2026, come indicato nella Fonte 2.",0.500,0.917,0.500,1.000,0.710
2025-10-20 09:20:38,Come posso presentare la domanda di immatricolazione?,"Risposta ibrida (α=0.6): La domanda di immatricolazione può essere presentata compilando il modulo on-line direttamente da casa accedendo al SOL - Segreterie On Line, come indicato nella fonte 1. Non sono presenti ulteriori informazioni dettagliate sulle procedure di immatricolazione nelle altre fonti, che trattano argomenti diversi come la laurea, la contribuzione universitaria, l'appello di verbalizzazione.",0.400,0.795,1.000,1.000,0.626
2025-10-20 09:20:38,Chi può beneficiare dell'esenzione totale dalle tasse universitarie?,"Risposta ibrida (α=0.6): Non ci sono informazioni che specificano chi può beneficiare dell'esenzione totale dalle tasse universitarie, tuttavia è presente una menzione alle agevolazioni su tasse e contributi universitari e alle condizioni per il pagamento della contribuzione agevolata per gli immatricolati per la prima volta al sistema universitario con un reddito ISEE ""Università"" tra 22.000,01 e 30.000,00 euro, che potranno recuperare le somme versate secondo le modalità specificate nell'apposito bando di prossima pubblicazione sul portale A.Di.S.U.",0.750,0.000,0.200,1.000,0.336
2025-10-20 09:20:38,Cosa si intende per 'Low-Tax Area' secondo il regolamento?,,nan,0.000,0.000,0.000,0.129
2025-10-20 09:20:38,Quali riduzioni sono previste per chi si immatricola con un voto di diploma alto?,"Risposta ibrida (α=0.6): È previsto un esonero totale o una riduzione parziale delle tasse di immatricolazione alle lauree triennali e magistrali a ciclo unico per gli studenti che si immatricolano con un voto di diploma alto, precisamente con un voto compreso tra 100/100 e lode e 95/100.",1.000,0.723,1.000,1.000,0.757
2025-10-20 09:20:38,Quali agevolazioni sono previste per studenti dello stesso nucleo familiare iscritti contemporaneamente?,Risposta ibrida (α=0.6): Non presente nei documenti,nan,0.000,0.000,0.000,0.133
2025-10-20 09:20:38,A chi bisogna rivolgersi per chiedere l'esonero dal corso sulla sicurezza?,"Risposta ibrida (α=0.6): Per chiedere l'esonero dal corso sulla sicurezza, lo studente può rivolgersi all'Ufficio sicurezza luoghi di lavoro, inviando una richiesta all'indirizzo email giovanni.chiappavento@unipg.it, qualora abbia già frequentato tale corso durante il percorso di studi nella scuola secondaria superiore.",1.000,0.872,1.000,1.000,0.613
2025-10-20 09:20:38,Chi è il referente per informazioni e sessioni di esame aggiuntive sul corso di sicurezza?,"Risposta ibrida (α=0.6): Il referente per informazioni e sessioni di esame aggiuntive sul corso di sicurezza è il prof. Antonio Moschitta, contattabile all'indirizzo email antonio.moschitta@unipg.it, come indicato nella fonte 1. Non sono presenti ulteriori informazioni specifiche sui referenti per il corso di sicurezza nelle altre fonti, sebbene la fonte 5 menzioni l'Ufficio sicurezza luoghi di lavoro e l'indirizzo email giovanni.chiappavento@unipg.it per richieste di esonero dal corso sulla sicurezza nei luoghi di lavoro, ma non si riferisce specificamente a sessioni di esame aggiuntive o informazioni sul corso di sicurezza in generale.",0.125,1.000,0.250,1.000,0.502
2025-10-20 09:20:38,Come può ottenere l’attestato lo studente che supera l’esame di sicurezza?,"Risposta ibrida (α=0.6): Una volta superato l’esame, lo studente può scaricare l'attestato dall'area riservata;",nan,0.798,1.000,1.000,0.198
2025-10-20 09:20:38,A cosa serve il corso sulla sicurezza nei luoghi di lavoro?,"Risposta ibrida (α=0.6): Il corso sulla sicurezza nei luoghi di lavoro serve per l'accesso ai laboratori, poiché è necessario seguire tale corso e sostenere una prova di esame per poter accedere ai laboratori, come indicato nella Fonte 4: ""Per l'accesso ai laboratori, è necessario seguire un corso sulla sicurezza nei luoghi di lavoro e sostenere una prova di esame"". Inoltre, il corso è anche utile per rispettare le norme in materia di igiene, sicurezza e salute sui luoghi di lavoro, come menzionato nella Fonte 1: ""rispettare le norme in materia di igiene, sicurezza e salute sui luoghi di lavoro, con particolare riferimento all’art. 20 del D. lgs 81/08"".",0.500,1.000,1.000,1.000,0.423
2025-10-20 09:20:38,Posso accedere al laboratorio senza aver seguito il corso sulla sicurezza?,"Risposta ibrida (α=0.6): Non è possibile accedere al laboratorio senza aver seguito il corso sulla sicurezza, come indicato nella Fonte 3, che specifica che ""Per l'accesso ai laboratori, è necessario seguire un corso sulla sicurezza nei luoghi di lavoro e sostenere una prova di esame"".",0.250,0.911,1.000,1.000,0.755
2025-10-20 09:20:38,Qual è il link per iscriversi al corso sulla sicurezza nei luoghi di lavoro?,Risposta ibrida (α=0.6): Non presente nei documenti,nan,0.000,0.000,0.000,0.129
2025-10-20 09:20:38,Il corso sulla sicurezza è erogato in presenza o a distanza?,"Risposta ibrida (α=0.6): Il corso sulla sicurezza è erogato interamente in presenza, come indicato nella Fonte 2.",0.500,0.445,0.000,0.000,0.153
2025-10-20 09:20:38,Cosa deve fare uno studente che non ha seguito il corso di sicurezza nella scuola superiore?,"Risposta ibrida (α=0.6): Se lo studente non ha seguito il corso di sicurezza nella scuola superiore, oppure non ha acquisito i crediti richiesti, occorre che segua un corso sulla sicurezza nei luoghi di lavoro e sostenere una prova di esame per l'accesso ai laboratori.",1.000,0.886,0.000,0.000,0.373
2025-10-20 09:20:38,È possibile organizzare sessioni di esame aggiuntive per il corso sulla sicurezza?,"Risposta ibrida (α=0.6): È possibile organizzare sessioni di esame aggiuntive per il corso sulla sicurezza, come indicato in [Fonte 1] dove si consiglia di contattare direttamente il prof. Antonio Moschitta per informazioni e sessioni di esame aggiuntive, e in [Fonte 2] che menziona la possibilità di organizzare sessioni di esame aggiuntive a richiesta, anche se non è specificato se ciò valga anche per il corso sulla sicurezza, tuttavia [Fonte 4] parla di un corso sulla sicurezza nei luoghi di lavoro e di una prova di esame, senza menzionare direttamente la possibilità di sessioni aggiuntive per questo corso specifico.",0.111,0.000,0.500,1.000,0.359
2025-10-20 09:20:38,Qual è l'orario delle lezioni di Intelligent and Secure Networks e quali sono le date degli appelli d'esame?,,nan,0.000,0.000,0.000,0.109
2025-10-20 09:20:38,Quali sono i moduli che servono per fare il tirocinio e con che tempistiche vanno consegnati?,"Risposta ibrida (α=0.6): Non è presente una descrizione dettagliata dei moduli necessari per il tirocinio, ma è menzionato che i documenti firmati e timbrati dalla struttura ospitante vanno consegnati alla Segreteria Didattica del Dipartimento di Ingegneria prima dell'inizio del tirocinio, senza specificare i moduli esatti o le tempistiche di consegna, se non che vanno consegnati prima dell'inizio del tirocinio.",0.429,0.000,0.000,0.000,0.400
2025-10-20 09:20:38,Quali strutture e servizi sono disponibili per gli studenti di Ingegneria a Perugia?,"Risposta ibrida (α=0.6): Gli studenti di Ingegneria dell'Università di Perugia hanno a disposizione laboratori di supporto alla didattica e alla ricerca, una vasta Biblioteca Centrale con sale di lettura, spazi attrezzati dove studiare, un servizio mensa, ampi spazi verdi e un servizio di ristoro bar, oltre al servizio di segreteria SOL per accedere ai servizi di segreteria senza recarsi allo sportello, per il quale è possibile contattare l'indirizzo e-mail help.didattica@unipg.it per eventuali chiarimenti o richieste di assistenza.",1.000,0.967,0.333,1.000,0.706
2025-10-20 09:20:38,Dove si trova il campus di Ingegneria e come è possibile raggiungerlo?,Risposta ibrida (α=0.6): Non presente nei documenti,nan,0.000,0.250,0.333,0.123
2025-10-20 09:20:38,È disponibile una rete Wi-Fi per gli studenti?,Risposta ibrida (α=0.6): Non presente nei documenti,nan,0.000,0.500,1.000,0.127
2025-10-20 09:20:38,Quali sono i giorni e gli orari di apertura al pubblico della Segreteria Studenti?,"Risposta ibrida (α=0.6): La Segreteria Studenti è aperta al pubblico i giorni martedì e giovedì con orario 10.00 - 13.00, come indicato nella fonte 1, che fornisce informazioni sui giorni e gli orari di apertura al pubblico. Non sono presenti altre informazioni più dettagliate o aggiornate nelle altre fonti fornite, quindi l'orario di apertura rimane quello indicato.",0.429,1.000,0.200,1.000,0.613
2025-10-20 09:20:38,Come si può contattare la Segreteria Studenti per telefono?,Risposta ibrida (α=0.6): Non presente nei documenti.,1.000,0.000,0.000,0.000,0.121
2025-10-20 09:20:38,Qual è l’indirizzo email della Segreteria Didattica del Dipartimento di Ingegneria?,Risposta ibrida (α=0.6): Non presente nei documenti,nan,0.000,0.000,0.000,0.137
2025-10-20 09:20:38,Come si può accedere ai servizi di segreteria senza recarsi fisicamente allo sportello?,"Risposta ibrida (α=0.6): È presente il termine ""servizi di segreteria"" e si può accedere ai servizi di segreteria senza recarsi fisicamente allo sportello tramite il servizio SOL, che l'ateneo di Perugia mette a disposizione degli studenti, per eventuali chiarimenti o richieste di assistenza, contattare il seguente indirizzo e-mail: help.didattica@unipg.it.",1.000,0.860,0.700,0.000,0.683
2025-10-20 09:20:38,A chi scrivere per assistenza sulla segreteria online SOL?,"Risposta ibrida (α=0.6): Per assistenza sulla segreteria online SOL, è possibile contattare l'indirizzo e-mail help.didattica@unipg.it, come indicato nella fonte 2, che fornisce informazioni sul servizio di segreteria SOL messo a disposizione degli studenti dall'ateneo di Perugia.",0.500,0.959,1.000,1.000,0.490
2025-10-20 09:20:38,È possibile aprire un ticket per richiedere assistenza alla Segreteria Studenti?,"Risposta ibrida (α=0.6): È possibile aprire un ticket per richiedere assistenza alla Segreteria Studenti, come indicato in alcuni punti del contesto fornito: ad esempio, ""Aprire un Ticket, servizio attivo h24 (Apri subito un ticket)"" e ""Se al momento dell’immatricolazione sei ancora minorenne compila il modulo di consenso e invialo tramite ticket, compilato e firmato dai tuoi genitori, alla segreteria studenti del corso che hai scelto"". Inoltre, sono presenti anche altre modalità per contattare la segreteria studenti, come ad esempio l'invio di una mail, ma l'apertura di un ticket è espressamente menzionata come un'opzione disponibile.",0.800,1.000,0.867,0.000,0.642
2025-10-20 09:20:38,Quali sono i giorni entro cui uno studente deve presentare la domanda di laurea e consegnare la tesi?,Risposta ibrida (α=0.6): Non presente nei documenti.,1.000,0.000,0.000,0.000,0.146
2025-10-20 09:20:38,Dove si compila la domanda di laurea online?,,nan,0.000,0.000,0.000,0.140
2025-10-20 09:20:38,Quanto costa la stampa della pergamena se richiesta durante la domanda di laurea?,"Risposta ibrida (α=0.6): Il costo della stampa della pergamena se richiesta durante la domanda di laurea è di 132 euro, che include anche il bollo previsto per la domanda di esame di laurea, come indicato nella sezione ""Elenco Tasse"" del sistema dopo la compilazione della domanda di laurea.",1.000,0.955,0.500,1.000,0.398
2025-10-20 09:20:38,"In base alle linee guida, quanti punti può ottenere una tesi di ricerca per la presentazione e discussione?","Risposta ibrida (α=0.6): La valutazione per la presentazione e discussione della tesi può variare a seconda delle linee guida considerate, con un massimo di 4 punti come indicato in Fonte 1 e Fonte 3, dove ""Fino a 4 punti per la presentazione e discussione della tesi. La valutazione è pari alla media dei punteggi attribuiti dai singoli Commissari"" e ""Fino a 4 punti per la presentazione e discussione della tesi. La valutazione è pari alla media"" rispettivamente. Tuttavia, Fonte 4 indica un massimo di 3 punti per la presentazione e discussione della tesi, con la valutazione pari alla media. Non è presente una valutazione univoca per tutte le fonti, ma in generale, una tesi di ricerca può ottenere fino a 4 punti per la presentazione e discussione secondo alcune linee guida.",0.300,0.000,0.333,1.000,0.596
2025-10-20 09:20:38,Quali allegati sono obbligatori nella domanda di laurea online?,Risposta ibrida (α=0.6): Non presente nei documenti.,0.000,0.000,0.000,0.000,0.151
2025-10-20 09:20:38,Quali sono i criteri di valutazione per una tesi compilativa?,Risposta ibrida (α=0.6): Non presente nei documenti,nan,0.000,0.200,0.500,0.136
2025-10-20 09:20:38,Quando può essere assegnata la lode nella laurea magistrale?,Risposta ibrida (α=0.6): Non presente nei documenti,nan,0.000,0.500,0.000,0.137
2025-10-20 09:20:38,Come si calcola il voto di laurea magistrale?,"Risposta ibrida (α=0.6): Il voto di laurea magistrale è presente nel contesto fornito, tuttavia solo la Fonte 1 fornisce informazioni sulla sua modalità di calcolo, affermando che si ottiene dalla somma, arrotondata all’unità, della media curriculare e del punteggio assegnato alla tesi di laurea, senza specificare se questo metodo si applichi anche alla laurea magistrale, ma essendo l'unica informazione disponibile nel contesto fornito, può essere considerata la più rilevante per la risposta alla domanda.",0.286,0.000,0.700,1.000,0.504
2025-10-20 09:20:38,Qual è il numero massimo di CFU di tirocinio che uno studente può ottenere nella stessa azienda?,Risposta ibrida (α=0.6): Non presente nei documenti.,1.000,0.000,0.000,0.000,0.135
2025-10-20 09:20:38,A quante ore di attività corrisponde un CFU di tirocinio?,"Risposta ibrida (α=0.6): A 1 CFU corrispondono 25 ore di attività di tirocinio, come indicato in più fonti, tra cui ""A 1 CFU corrispondono 25 ore di attività di tirocinio"" e ""CFU associati al tirocinio: (corrispondenti a ore di attività, 1 CFU=25 ore)"".",0.500,0.971,0.417,1.000,0.496
2025-10-20 09:20:38,Qual è il numero massimo di tirocinanti che un'azienda con 10 dipendenti può ospitare contemporaneamente?,"Risposta ibrida (α=0.6): Il numero massimo di tirocinanti che un'azienda con 10 dipendenti può ospitare contemporaneamente è di due, poiché rientra nella fascia di aziende con un numero di dipendenti a tempo indeterminato compreso tra sei e diciannove, come indicato nel contesto fornito.",1.000,1.000,0.417,1.000,0.540
2025-10-20 09:20:38,Un docente universitario può essere tutor di quanti tirocinanti interni?,"Risposta ibrida (α=0.6): Un docente universitario può essere tutor di al massimo 3 tirocinanti interni contemporaneamente, come indicato in più fonti che specificano questo limite per i tirocini interni, ad esempio: ""Per i tirocini interni, un docente può essere tutor al massimo di 3 tirocinanti contemporaneamente"" e ""Per i tirocini interni, un tutor di struttura non può seguire contemporaneamente più di tre tirocinanti"".",1.000,0.869,0.867,1.000,0.423
2025-10-20 09:20:38,L’attività lavorativa passata può essere riconosciuta come tirocinio curriculare?,"Risposta ibrida (α=0.6): L'attività lavorativa passata può essere riconosciuta come tirocinio curriculare, come indicato nella Fonte 3, che specifica che l'attività lavorativa svolta da uno studente può essere riconosciuta a posteriori in luogo della frequenza al tirocinio curriculare, se considerata congruente con gli obiettivi formativi del Corso di Studi, certificata in base alla normativa vigente e conclusa entro i 3 anni dalla data di presentazione della domanda di riconoscimento.",0.714,0.860,0.367,1.000,0.570
2025-10-20 09:20:38,Quanto tempo prima bisogna consegnare i moduli di tirocinio?,,nan,0.000,0.000,0.000,0.138
2025-10-20 09:20:38,Cosa accade se l’azienda non è ancora convenzionata con il Dipartimento?,"Risposta ibrida (α=0.6): Se l’azienda non è ancora convenzionata con il Dipartimento, si raccomanda un intervallo più ampio e dovrà essere finalizzata una Convenzione di tirocinio tra l’azienda e il Dipartimento, con consegna alla Segreteria Didattica del Dipartimento di Ingegneria dei documenti firmati e timbrati in originale dalla struttura ospitante prima dell'inizio del tirocinio.",1.000,0.727,0.478,1.000,0.669
2025-10-20 09:20:38,Come si svolge la verbalizzazione del tirocinio?,Risposta ibrida (α=0.6): Non presente nei documenti.,1.000,0.000,0.583,0.000,0.152
2025-10-20 09:20:38,Chi deve firmare il registro delle ore di tirocinio?,"Risposta ibrida (α=0.6): Il registro delle ore di tirocinio deve essere firmato dal tutor aziendale al termine del tirocinio, come indicato nel testo che recita: ""Il registro viene firmato dal tutor aziendale al termine del tirocinio"".",1.000,0.896,0.250,1.000,0.441
2025-10-20 09:20:38,Qual è la valutazione finale del tirocinio?,"Risposta ibrida (α=0.6): La valutazione finale del tirocinio è menzionata in più fonti, in particolare nell'Art. 4 della Fonte 1, che si intitola ""Valutazione finale"", e nella Fonte 2, che specifica che sia lo studente che il tutor aziendale compilano un modulo di valutazione dell'esperienza di tirocinio prima della valutazione finale. Inoltre, la Fonte 3 e la Fonte 5 contengono titoli relativi alla valutazione dell'attività di stage e del servizio stage e tirocini, rispettivamente, sebbene non forniscano dettagli specifici sulla valutazione finale. Non sono presenti ulteriori dettagli sulla valutazione finale nel testo fornito.",0.308,0.000,0.000,0.000,0.150
2025-10-20 09:20:38,Il tirocinio può essere svolto in remoto?,Risposta ibrida (α=0.6): Non presente nei documenti,nan,0.000,0.000,0.000,0.144
2025-10-20 09:20:38,È possibile svolgere il tirocinio presso un laboratorio interno del Dipartimento?,"Risposta ibrida (α=0.6): È possibile svolgere il tirocinio presso un laboratorio interno del Dipartimento, come indicato in più fonti: ad esempio, la Fonte 1 specifica che ""per un tirocinio interno, la struttura è solitamente un laboratorio di ricerca o didattico del Dipartimento"", mentre la Fonte 4 precisa che ""ogni studente può fare esperienza in una singola azienda, o laboratorio interno, per un massimo di 9 CFU"" e la Fonte 5 menziona che i Corsi di Studio del Dipartimento offrono la possibilità di svolgere tirocini ""presso i Laboratori del Dipartimento (tirocinio interno)"" come parte della formazione.",0.625,1.000,1.000,1.000,0.459
2025-10-20 09:20:38,Qual è l’indirizzo email a cui inviare il registro firme del tirocinio?,Risposta ibrida (α=0.6): Non presente nei documenti,nan,0.000,0.000,0.000,0.881
2025-10-20 09:20:38,Che cosa si intende per tutorato di sostegno nei corsi di primo livello?,Risposta ibrida (α=0.6): Non presente nei documenti,nan,0.000,0.000,0.000,0.126
2025-10-20 09:20:38,Chi stabilisce i criteri e le modalità di assegnazione dei tutor ai diversi corsi di studio?,"Risposta ibrida (α=0.6): I criteri e le modalità di assegnazione dei tutor ai diversi corsi di studio saranno stabiliti dal Consiglio di Dipartimento sentiti i presidenti dei Corsi di Laurea interessati, come indicato nel testo ""I criteri e le modalità di assegnazione dei tutor ai diversi CdS/insegnamenti saranno stabiliti dal Consiglio di Dipartimento sentiti i presidenti dei Corsi di Laurea interessati"".",1.000,0.984,1.000,1.000,0.769
2025-10-20 09:20:38,A chi è destinato il tutorato individuale?,"Risposta ibrida (α=0.6): Il tutorato individuale è destinato agli studenti delle lauree triennali, come specificato nella Fonte 2, che menziona ""Tutorato individuale per gli studenti delle lauree triennali"".",0.333,1.000,0.333,1.000,0.589
2025-10-20 09:20:38,Cosa viene garantito agli studenti diversamente abili nel tutorato individuale?,"Risposta ibrida (α=0.6): Nel contesto fornito, è presente il termine ""tutorato individuale"" e viene menzionato che, qualora vengano immatricolati soggetti diversamente abili, la struttura didattica provvederà, su richiesta, a mettere a disposizione mezzi strumentali e personale di supporto, secondo le specifiche esigenze, quindi agli studenti diversamente abili nel tutorato individuale viene garantito l'accesso a mezzi strumentali e personale di supporto secondo le loro esigenze specifiche.",0.750,0.947,0.333,1.000,0.764
2025-10-20 09:20:38,Chi fornisce il tutorato per gli insegnamenti di base nei corsi di primo livello?,,nan,0.000,0.000,0.000,0.125
2025-10-20 09:20:38,Qual è la finalità principale del tutorato di sostegno?,Risposta ibrida (α=0.6): Non presente nei documenti,nan,0.000,0.000,0.000,0.126
2025-10-20 09:20:38,È previsto un tutorato specifico per le lauree magistrali?,"Risposta ibrida (α=0.6): Non è presente un riferimento diretto a un tutorato specifico per le lauree magistrali, tuttavia, in Fonte 4, è menzionato un ""tutor Universitario"" per il corso di laurea in Triennale Magistrale, il che potrebbe implicare l'esistenza di un sistema di tutorato anche per le lauree magistrali, sebbene non sia specificato in modo dettagliato.",0.250,0.000,0.000,0.000,0.711
2025-10-20 09:20:38,=== MEDIA TOTALE ===,,0.648,0.459,0.427,0.565,0.399
